{
  "type": "object",
  "properties": {
    "schema_version": {
      "const": 1
    },
    "argv": {
      "type": "array",
      "items": {
        "type": "string"
      }
    },
    "status": {
      "enum": [
        "succeeded",
        "failed",
        "timed_out",
        "cancelled",
        "memory_exceeded"
      ]
    },
    "exit_code": {
      "anyOf": [
        {
          "type": "integer"
        },
        {
          "type": "null"
        }
      ]
    },
    "started_at": {
      "type": "string",
      "format": "date-time"
    },
    "finished_at": {
      "type": "string",
      "format": "date-time"
    },
    "elapsed_seconds": {
      "type": "number",
      "minimum": 0
    },
    "peak_rss_bytes": {
      "anyOf": [
        {
          "type": "integer",
          "minimum": 0
        },
        {
          "type": "null"
        }
      ]
    },
    "warnings": {
      "type": "array",
      "items": {
        "type": "string"
      }
    }
  },
  "required": [
    "schema_version",
    "argv",
    "status",
    "exit_code",
    "started_at",
    "finished_at",
    "elapsed_seconds",
    "peak_rss_bytes",
    "warnings"
  ],
  "additionalProperties": false,
  "$schema": "https://json-schema.org/draft/2020-12/schema",
  "$id": "https://researchflow.local/v1/process_report.json"
}
