{
  "schema_version": 1,
  "argv": [
    "python",
    "fixture.py"
  ],
  "status": "succeeded",
  "exit_code": 0,
  "started_at": "2026-10-25T00:00:00Z",
  "finished_at": "2026-10-25T00:00:01Z",
  "elapsed_seconds": 1.0,
  "peak_rss_bytes": null,
  "warnings": [
    "Synthetic example, not a measurement."
  ]
}
